{
  "$schema": "https://json-schema.org/draft/2020-12/schema",
  "$id": "https://yukh.example/schemas/capability/v1/definition.schema.json",
  "type": "object",
  "additionalProperties": false,
  "required": [
    "contract_version", "capability", "resource", "environment", "operation",
    "input", "output", "risk", "mutation", "approval", "execution",
    "idempotency", "retry", "verification", "rollback", "errors"
  ],
  "properties": {
    "contract_version": { "const": 1 },
    "capability": {
      "type": "object",
      "additionalProperties": false,
      "required": ["id", "version", "summary", "stability"],
      "properties": {
        "id": { "$ref": "https://yukh.example/schemas/capability/v1/common.schema.json#/$defs/capabilityId" },
        "version": { "$ref": "https://yukh.example/schemas/capability/v1/common.schema.json#/$defs/semver" },
        "summary": { "type": "string", "minLength": 1, "maxLength": 256 },
        "stability": { "enum": ["experimental", "preview", "stable", "deprecated"] }
      }
    },
    "resource": {
      "type": "object",
      "additionalProperties": false,
      "required": ["kinds", "cardinality"],
      "properties": {
        "kinds": {
          "type": "array", "minItems": 1, "maxItems": 16, "uniqueItems": true,
          "items": { "type": "string", "pattern": "^[a-z][a-z0-9._-]{0,63}$", "maxLength": 64 }
        },
        "cardinality": { "enum": ["one", "many"] },
        "max_items": { "type": "integer", "minimum": 1, "maximum": 1000 }
      },
      "allOf": [
        {
          "if": { "properties": { "cardinality": { "const": "many" } }, "required": ["cardinality"] },
          "then": { "required": ["max_items"], "properties": { "max_items": true } },
          "else": { "not": { "required": ["max_items"] } }
        }
      ]
    },
    "environment": {
      "type": "object", "additionalProperties": false, "required": ["required"],
      "properties": { "required": { "const": true } }
    },
    "operation": {
      "type": "object", "additionalProperties": false,
      "required": ["model", "class", "effects"],
      "properties": {
        "model": { "const": "typed" },
        "class": { "enum": ["read", "mutate"] },
        "effects": {
          "type": "array", "minItems": 1, "maxItems": 5, "uniqueItems": true,
          "items": { "enum": ["observe", "create", "update", "delete", "emit"] }
        }
      }
    },
    "input": {
      "type": "object", "additionalProperties": false, "required": ["schema"],
      "properties": { "schema": { "type": "object" } }
    },
    "output": {
      "type": "object", "additionalProperties": false, "required": ["schema"],
      "properties": { "schema": { "type": "object" } }
    },
    "risk": {
      "type": "object", "additionalProperties": false,
      "required": ["level", "data_classes"],
      "properties": {
        "level": { "enum": ["low", "medium", "high", "critical"] },
        "data_classes": {
          "type": "array", "maxItems": 16, "uniqueItems": true,
          "items": { "type": "string", "pattern": "^[a-z][a-z0-9_]{0,63}$", "maxLength": 64 }
        }
      }
    },
    "mutation": {
      "type": "object", "additionalProperties": false,
      "required": ["mode", "destructive"],
      "properties": {
        "mode": { "enum": ["none", "planned", "transactional"] },
        "destructive": { "type": "boolean" }
      }
    },
    "approval": {
      "type": "object", "additionalProperties": false, "required": ["mode"],
      "properties": { "mode": { "enum": ["never", "policy", "explicit"] } }
    },
    "execution": {
      "type": "object", "additionalProperties": false,
      "required": ["timeout_ms", "max_attempts", "concurrency", "max_input_bytes", "max_output_bytes"],
      "properties": {
        "timeout_ms": { "type": "integer", "minimum": 1, "maximum": 300000 },
        "max_attempts": { "type": "integer", "minimum": 1, "maximum": 5 },
        "concurrency": { "enum": ["unrestricted_read", "per_subject", "per_resource", "exclusive_scope"] },
        "max_input_bytes": { "type": "integer", "minimum": 2, "maximum": 1048576 },
        "max_output_bytes": { "type": "integer", "minimum": 2, "maximum": 4194304 }
      }
    },
    "idempotency": {
      "type": "object", "additionalProperties": false,
      "required": ["classification", "key"],
      "properties": {
        "classification": { "enum": ["naturally_idempotent", "keyed", "non_idempotent"] },
        "key": { "enum": ["required", "optional", "forbidden"] }
      }
    },
    "retry": {
      "type": "object", "additionalProperties": false, "required": ["policy"],
      "properties": {
        "policy": { "enum": ["never", "safe_before_start_only", "safe_on_declared_transient_before_effect", "provider_verified_idempotent"] }
      }
    },
    "verification": {
      "type": "object", "additionalProperties": false,
      "required": ["mode", "postconditions"],
      "properties": {
        "mode": { "enum": ["required", "not_applicable"] },
        "postconditions": {
          "type": "array", "maxItems": 32, "uniqueItems": true,
          "items": { "type": "string", "pattern": "^[a-z][a-z0-9_]{1,63}$", "maxLength": 64 }
        }
      },
      "allOf": [
        {
          "if": { "properties": { "mode": { "const": "required" } }, "required": ["mode"] },
          "then": { "properties": { "postconditions": { "type": "array", "minItems": 1 } } },
          "else": { "properties": { "postconditions": { "type": "array", "maxItems": 0 } } }
        }
      ]
    },
    "rollback": {
      "type": "object", "additionalProperties": false, "required": ["mode"],
      "properties": {
        "mode": { "enum": ["not_applicable", "compensating", "restore", "unavailable"] },
        "rationale": { "type": "string", "minLength": 1, "maxLength": 512 },
        "recovery": { "type": "string", "minLength": 1, "maxLength": 512 },
        "stop_conditions": {
          "type": "array", "minItems": 1, "maxItems": 16, "uniqueItems": true,
          "items": { "type": "string", "minLength": 1, "maxLength": 256 }
        }
      }
    },
    "errors": {
      "type": "object", "additionalProperties": false, "required": ["taxonomy_version"],
      "properties": { "taxonomy_version": { "const": 1 } }
    }
  }
}
