{
  "contract_version": 1,
  "capability": {
    "id": "example.setting.update",
    "version": "1.0.0",
    "summary": "Update one bounded synthetic setting",
    "stability": "experimental"
  },
  "resource": { "kinds": ["example_setting"], "cardinality": "one" },
  "environment": { "required": true },
  "operation": { "model": "typed", "class": "mutate", "effects": ["update"] },
  "input": {
    "schema": {
      "type": "object",
      "additionalProperties": false,
      "required": ["name", "value"],
      "properties": {
        "name": { "type": "string", "pattern": "^[a-z][a-z0-9_]{0,31}$", "maxLength": 32 },
        "value": { "type": "string", "minLength": 1, "maxLength": 128 }
      }
    }
  },
  "output": {
    "schema": {
      "type": "object",
      "additionalProperties": false,
      "required": ["changed", "version"],
      "properties": {
        "changed": { "type": "boolean" },
        "version": { "type": "integer", "minimum": 1, "maximum": 2147483647 }
      }
    }
  },
  "risk": { "level": "high", "data_classes": ["synthetic_configuration"] },
  "mutation": { "mode": "planned", "destructive": false },
  "approval": { "mode": "explicit" },
  "execution": {
    "timeout_ms": 10000,
    "max_attempts": 1,
    "concurrency": "per_resource",
    "max_input_bytes": 4096,
    "max_output_bytes": 8192
  },
  "idempotency": { "classification": "keyed", "key": "required" },
  "retry": { "policy": "never" },
  "verification": { "mode": "required", "postconditions": ["setting_value_matches"] },
  "rollback": { "mode": "restore" },
  "errors": { "taxonomy_version": 1 }
}
